{
  "schema": "ve-verdict/1",
  "piece": "2026-10-23-friday-two-passports-long-ve",
  "cut": "long-wide",
  "sha256": "d09ec3a990d590a383981354d54be16c62aa6b588252fff24581c7fdf4814fc5",
  "reviewer": "independent Critic, fresh Claude Opus context, 2026-10-30",
  "reviewed_at": "2026-10-30T13:25:34.680213+00:00",
  "lens_sha256": "2d62c9e235d86f192747eaeea0115befc2ef3ae7b6448684248271100582f7c1",
  "frames_viewed": [
    {
      "at_s": 0.5
    },
    {
      "at_s": 2.6
    },
    {
      "at_s": 20.0
    },
    {
      "at_s": 34.3
    },
    {
      "at_s": 65.2
    },
    {
      "at_s": 74.1
    },
    {
      "at_s": 116.0
    },
    {
      "at_s": 172.0
    },
    {
      "at_s": 173.5
    },
    {
      "at_s": 236.1
    },
    {
      "at_s": 243.7
    },
    {
      "at_s": 245.1
    },
    {
      "at_s": 270.0
    },
    {
      "at_s": 322.0
    }
  ],
  "findings": [
    {
      "severity": "block",
      "area": "other",
      "frame_s": 172.5,
      "text": "The loop restart at 172.0 s drops into the track's quiet intro: from 172.5 to 173.56 s the music falls to -45 to -62 dB (1 s average -41.7 against a -33 bed), mostly while the voice is silent, then snaps back to -28 dB within 20 ms, recreating the owner's 'turns off then gets louder' complaint."
    },
    {
      "severity": "fix",
      "area": "other",
      "frame_s": 2.56,
      "text": "The opening bed sits at -41 to -49 dB for 0 to 2.56 s, then jumps +15 to +18 dB within 20 ms under the first sentence; start the music past the track's quiet intro or fade it in."
    },
    {
      "severity": "fix",
      "area": "other",
      "frame_s": 321.08,
      "text": "After the voice ends at 320.34 s the music jumps about 13 to 16 dB above the bed at 321.08 s for about 2.3 s, then fades in about 0.3 s, which contradicts the one-steady-level brief."
    },
    {
      "severity": "fix",
      "area": "other",
      "frame_s": 243.6,
      "text": "A stray 0.25 s voiced blip (-18 dB RMS, peak -9.5 dBFS) at 243.58 to 243.83 s sits alone in the pause between 'Every single time.' and 'Then a board briefing'; it is in neither the script nor words.json and was also in the rejected mix."
    },
    {
      "severity": "note",
      "area": "other",
      "frame_s": 74.5,
      "text": "After the 74.1 s and 245.1 s crossfades the bed changes texture (bass -6 dB, nothing above 5 kHz, weaker beat) with 0.3 to 0.4 s dips at 74.8 and 245.7 s; the level holds on a 1 s scale but the change is audible as a new section."
    },
    {
      "severity": "note",
      "area": "other",
      "frame_s": 172.0,
      "text": "The music bed is one 171 s arrangement played twice, so the second half repeats the first verbatim."
    },
    {
      "severity": "note",
      "area": "copy",
      "frame_s": 245.1,
      "text": "words.json onsets after pauses run 0.3 to 0.5 s ahead of the voice (1.1 s for 'Then' at 244.21 against 245.32 spoken), so some captions appear before the word is heard."
    },
    {
      "severity": "note",
      "area": "copy",
      "frame_s": 116.0,
      "text": "The caption reads 'That's pretty Awkward.' with a capital A mid-sentence (picture unchanged from the accepted version)."
    },
    {
      "severity": "note",
      "area": "evidence",
      "frame_s": 243.7,
      "text": "The card claims '3/3 runs where DeepSeek deleted its Xinjiang answer' while the voice says each model was asked twice and the chart shows DeepSeek 1/2."
    },
    {
      "severity": "note",
      "area": "composition",
      "frame_s": 270.0,
      "text": "The call card stacks a 'THE CALL' label over the headline 'OUR CALL.', and its 90%-sure prediction is never spoken in the voiceover."
    },
    {
      "severity": "note",
      "area": "other",
      "frame_s": 0.0,
      "text": "The music no longer follows the voice (speech -33.22 dB against pauses -33.31 dB, correlation 0.04, against 0.75 in the rejected mix), 20 s pause blocks hold -32.5 to -35.5 dB (rejected: -24.2 to -33.7), and the master measures -14.2 LUFS integrated, -1.4 dBTP, LRA 4.2 LU."
    }
  ],
  "blocking": true
}
